"rectype","issueid","project_owner","project_name","actor","time","text","action","title"
"issue_title","437","idan","oauthlib","jandd","2016-09-17 09:42:54","This pull request fixes the ""TypeError: argument of type 'NoneType' is not iterable"" that was caused by calling the openid_connect validate_authorization method with a request where request.scopes was
set to None (fixes #436).
","start issue","Fix TypeError in openid_connect"
"issue_closed","437","idan","oauthlib","thedrow","2016-11-24 16:00:10","","closed issue","Fix TypeError in openid_connect"
"pull_request_title","437","idan","oauthlib","jandd","2016-09-17 09:42:54","This pull request fixes the ""TypeError: argument of type 'NoneType' is not iterable"" that was caused by calling the openid_connect validate_authorization method with a request where request.scopes was
set to None (fixes #436).
","d8ba5858a024efebc3e918ad6b9134d11a1c2120","Fix TypeError in openid_connect"
"issue_comment","437","idan","oauthlib","jandd","2016-09-17 09:50:56","The tox run for py32 in the Travis build fails for reasons not related to the code change.
","",""
"issue_comment","437","idan","oauthlib","jandd","2016-09-17 10:21:43","The build fails for the cloned master branch as well (see https://travis-ci.org/jandd/oauthlib/jobs/160642978)
","",""
"issue_comment","437","idan","oauthlib","yon2004","2016-09-22 13:17:34","Can confirm that this fixes the issue. Thanks @jandd 
","",""
"issue_comment","437","idan","oauthlib","Sumukh","2016-10-07 04:06:44","If you merge master back in - tests should pass again. 

I'm not sure who is responsible for merging/reviewing - but the change in here is really small and can only fix errors (which is impacting a lot of users of downstream libraries). 
","",""
"issue_comment","437","idan","oauthlib","thedrow","2016-11-24 16:00:10","#450 Should fix this","",""
"pull_request_commit","437","idan","oauthlib","jandd","2016-09-17 09:38:50","Fix TypeError in openid_connect

This commit fixes the ""TypeError: argument of type 'NoneType' is not
iterable"" that was caused by calling the openid_connect
validate_authorization method with a request where request.scopes was
set to None.","d8ba5858a024efebc3e918ad6b9134d11a1c2120",""
