"rectype","issueid","project_owner","project_name","actor","time","text","action","title"
"issue_title","859","nilearn","nilearn","banilo","2015-11-26 10:20:57","Often times we need to convert floating point images to corresponding binarize 0-1 image. It would just be fantastic to have a neat nilearn function to do this in various flavors.
","start issue","Binarize image option for nilearn.image"
"issue_comment","859","nilearn","nilearn","KamalakerDadi","2015-11-26 12:37:06","I think I am missing the priority here. May be before this we need to address this circular importing error #835 ?
","",""
"issue_comment","859","nilearn","nilearn","AlexandreAbraham","2016-01-12 11:40:56","This is linked to #847, we should probably propose a set of tools for image manipulation.
","",""
