"rectype","issueid","project_owner","project_name","actor","time","text","action","title"
"issue_title","1544","nilearn","nilearn","banilo","2017-11-09 16:11:19","Add our recent HBM paper to the docstring, because the paper contains extensive step-by-step explanation of how the method works and gives toy examples.","start issue","new sparse-invcov ref in docstring"
"issue_closed","1544","nilearn","nilearn","GaelVaroquaux","2017-11-19 16:03:07","","closed issue","new sparse-invcov ref in docstring"
"pull_request_title","1544","nilearn","nilearn","banilo","2017-11-09 16:11:19","Add our recent HBM paper to the docstring, because the paper contains extensive step-by-step explanation of how the method works and gives toy examples.","c071239ad378fdf1399e723b3bd8f664ca6d9382","new sparse-invcov ref in docstring"
"issue_comment","1544","nilearn","nilearn","KamalakerDadi","2017-11-14 18:21:58",">Arguably, the citation that we should add is arXiv:1207.4255 (never published beyond arXiv ;( ), as we use the algorithm of this paper.

The citation you have mentioned is somehow hidden in
https://github.com/nilearn/nilearn/blob/master/doc/developers/group_sparse_covariance.rst","",""
"pull_request_commit","1544","nilearn","nilearn","banilo","2017-11-09 16:09:54","new sparse-invcov ref in docstring","c071239ad378fdf1399e723b3bd8f664ca6d9382",""
