"rectype","issueid","project_owner","project_name","actor","time","text","action","title"
"issue_title","944","nilearn","nilearn","bcipolli","2016-01-13 13:50:26","This is in reference to https://github.com/nilearn/nilearn/pull/832 

I hit an error while calling a `Masker` without having called `fit()` first. When investigating, I saw that most maskers / functions call `_check_fitted()`. Here is a place where it was not called.

Pretty sure this is the right thing...
","start issue","[MRG+1] BF: Check that mask is fitted before accessing fitted data."
"issue_closed","944","nilearn","nilearn","AlexandreAbraham","2016-01-13 23:03:14","","closed issue","[MRG+1] BF: Check that mask is fitted before accessing fitted data."
"pull_request_title","944","nilearn","nilearn","bcipolli","2016-01-13 13:50:25","This is in reference to https://github.com/nilearn/nilearn/pull/832 

I hit an error while calling a `Masker` without having called `fit()` first. When investigating, I saw that most maskers / functions call `_check_fitted()`. Here is a place where it was not called.

Pretty sure this is the right thing...
","2bdbadde2c387a865f7904b45dbd2a904c219e08","[MRG+1] BF: Check that mask is fitted before accessing fitted data."
"pull_request_merged","944","nilearn","nilearn","AlexandreAbraham","2016-01-13 23:03:14","[MRG+1] BF: Check that mask is fitted before accessing fitted data.","a097ee8cbca038087ea8c52b5cb8c40db0b0c557","Pull request merge from bcipolli/nilearn:bf-check_fitted to nilearn/nilearn:master"
"pull_request_commit","944","nilearn","nilearn","bcipolli@ucsd.edu","2015-11-17 00:43:24","BF: Check that mask is fitted before accessing fitted data.","2bdbadde2c387a865f7904b45dbd2a904c219e08",""
