"rectype","issueid","project_owner","project_name","actor","time","text","action","title"
"issue_title","1510","nilearn","nilearn","grjd","2017-09-14 07:39:24","I want to use scikit.cluster.Ward for group analysis. For one nii object it is straightforward to use the code bellow to fit one 4D object (""fmri_masked"") .
ward = FeatureAgglomeration(n_clusters, linkage='ward')
ward.fit(fmri_masked)
Is it possible to do Ward clustering for a list of objects, that is, rather than 1 fmri scan a list of them ?
thanks","start issue","Ward clustering for n niis"
"issue_closed","1510","nilearn","nilearn","KamalakerDadi","2017-10-10 15:58:17","","closed issue","Ward clustering for n niis"
"issue_comment","1510","nilearn","nilearn","KamalakerDadi","2017-09-14 07:43:37","For the moment you can use this PR #1370 
Thanks","",""
"issue_comment","1510","nilearn","nilearn","KamalakerDadi","2017-09-14 07:46:01","A working example which shows how to use Clustering object is in this [example](https://2619-1235740-gh.circle-artifacts.com/0/home/ubuntu/nilearn/doc/_build/html/auto_examples/03_connectivity/plot_rest_clustering.html#sphx-glr-auto-examples-03-connectivity-plot-rest-clustering-py)
","",""
"issue_comment","1510","nilearn","nilearn","KamalakerDadi","2017-10-10 15:58:17","Closing this one as we can discuss about this issue in #1521 ","",""
